incident_id,title,window,scope,detected_by,status,root_cause,customer_impact,resolution,owner
INC-001,Match-rate drop across all networks,2025-11 to 2026-02,"Customer: Motive Care (propagated to all network-level match rates)",robust_zscore on network match_rate; decomposition by customer isolated Motive Care,resolved,"Motive Care onboarded 2025-11 with address lines concatenated into a single field by their EHR export, degrading demographic matching on every downstream network (~25 pt match-rate drop for their panel). Network-level series dropped in lockstep — a correlated cross-network drop indicates a demographics/customer-mix cause, not a network outage.","Motive Care patients returned sparse histories; national match KPI dropped ~2.5 pts.","Address parser fix deployed in their intake pipeline 2026-03; match rate recovered to expected range within one cycle.",Data Quality Eng
INC-002,Carequality coverage collapse in South-Atlantic states,2026-02,"States: MD VA NC SC GA FL / Network: Carequality",robust_zscore on state+network coverage_rate (peak |z| ≈ 10),resolved,"A major South-Atlantic Carequality implementer had a responder outage during a data-center migration; queries timed out and returned empty bundles. Confirmed by records_returned collapsing ~70% while patients_queried was flat.","One-month gap in EHR-sourced conditions/encounters/documents for ~6 states; customers with South-Atlantic panels (Oak Grove, Bluebird) saw the largest dips.","Implementer restored responders 2026-03-04; backfill queries recovered historical documents. Added per-implementer responder health monitoring.",Network Ops
INC-003,Quest lab freshness SLO breach,2026-04 to 2026-05,"Network: Quest Labs / Data type: labs (all states)",slo_breach + robust_zscore on median_freshness_days (3d → ~19d),resolved,"Quest changed their result-feed schema (new OBX segments) in early April; our ingest quarantined non-conforming messages for manual review, delaying availability. Volume was unaffected — only latency — which pointed at ingest, not the feed itself.","Lab-dependent workflows (e.g. Cascade Kidney eGFR monitoring) saw results arriving ~2.5 weeks late; SLO (7d) breached 2 months.","Parser updated 2026-05-28; quarantine drained. Added schema-drift canary on inbound lab feeds.",Ingest Platform
INC-004,ADT coverage loss in WA/OR via PointClickCare,2025-12 to 2026-05,"States: WA OR / Network: PointClickCare / Data type: adt_events",level_shift detector (6-mo trailing vs leading mean; z-score missed it),resolved,"A regional contract lapse removed Pacific-Northwest facilities from our PointClickCare feed. Because the loss persisted 6 months it shifted the series median and evaded z-score detection — caught by the level-shift detector. Bamboo Health partially masked the gap in blended ADT coverage.","Harborview VBC and Cascade Kidney (WA/OR-concentrated) lost ~95% of PCC-sourced admission alerts; readmission-outreach programs degraded.","Contract renewed 2026-06; feed restored. Blended-network dashboards now also break out per-partner coverage so one partner can't mask another.",Partnerships
INC-005,Structural document coverage gap in TX/OK/MS (+FL/AR),ongoing,"States: TX OK MS FL AR / Data type: documents / Networks: Carequality CommonWell",cross-sectional gap detection (>40% below national mean for 3+ months),open,"Not an incident — a structural gap. Rural provider participation in nationwide EHR networks is low in these states, so document retrieval underperforms the national mean by 40-45% persistently. TEFCA QHIN onboarding is expected to close part of the gap.","Customers with Gulf-state panels (Oak Grove, Bluebird) consistently receive thinner document histories; set expectations during onboarding and in coverage reports.","Mitigation: prioritize regional HIE partnerships in TX/OK/MS; track TEFCA ramp quarterly. Not resolvable by engineering alone.",Network Strategy
